Brand,Brand Line
Johnnie Walker Scotch,Explorers' Club The Adventurer Scotch
Johnnie Walker Scotch,Explorers' Club The Gold Route Scotch
Johnnie Walker Scotch,Explorers' Club The Royal Route Scotch
Johnnie Walker Scotch,Explorers' Club The Spice Road Scotch
Johnnie Walker Scotch,Johnnie Walker 1820 Scotch
Johnnie Walker Scotch,Johnnie Walker 18yr
Johnnie Walker Scotch,Johnnie Walker Black Scotch
Johnnie Walker Scotch,Johnnie Walker Blenders' Batch
Johnnie Walker Scotch,Johnnie Walker Blue King George V Scotch
Johnnie Walker Scotch,Johnnie Walker Blue Scotch
Johnnie Walker Scotch,Johnnie Walker Collection Scotch
Johnnie Walker Scotch,Johnnie Walker Double Black Scotch
Johnnie Walker Scotch,Johnnie Walker Excelsior
Johnnie Walker Scotch,Johnnie Walker Gold 18yr Scotch
Johnnie Walker Scotch,Johnnie Walker Gold Reserve Scotch
Johnnie Walker Scotch,Johnnie Walker Green Malt Scotch
Johnnie Walker Scotch,Johnnie Walker Island Green
Johnnie Walker Scotch,Johnnie Walker Oldest Scotch
Johnnie Walker Scotch,Johnnie Walker Platinum 18yr Scotch
Johnnie Walker Scotch,Johnnie Walker Premier Scotch
Johnnie Walker Scotch,Johnnie Walker Quest
Johnnie Walker Scotch,Johnnie Walker Red Rye Finish
Johnnie Walker Scotch,Johnnie Walker Red Scotch
Johnnie Walker Scotch,Johnnie Walker XR Scotch
Johnnie Walker Scotch,Swing Scotch
Johnnie Walker Scotch,The John Walker Odyssey Scotch
Johnnie Walker Scotch,The John Walker Scotch